<?xml version="1.0"?>
<Channels xmlns:xsi="http://www.w3.org/2001/XMLSchema-instance"
	xsi:noNamespaceSchemaLocation="giapi-epics-status-mapping.xsd">
	<ChannelConfig>
		<giapiname>giapiname</giapiname>
		<epicsname>epicsname</epicsname>
		<type>INT</type>
		<initial>2</initial>
	</ChannelConfig>
	<ChannelConfig>
		<giapiname>giapiname2</giapiname>
		<epicsname>epicsname2</epicsname>
		<type>FLOAT</type>
		<initial>3</initial>
	</ChannelConfig>
	<ChannelConfig>
		<giapiname>giapiname3</giapiname>
		<epicsname>epicsname3</epicsname>
		<type>DOUBLE</type>
		<initial>3</initial>
	</ChannelConfig>
	<ChannelConfig>
		<giapiname>giapiname4</giapiname>
		<epicsname>epicsname4</epicsname>
		<type>STRING</type>
		<initial>hola</initial>
	</ChannelConfig>
</Channels>
